{
  "identities": [],
  "projects": [
    {
      "version": 1,
      "description_hash": "e3e279764f2fc770a732ddf6e49dfa9616fe8b0903eaef0d1120d629f485fe42",
      "description_text": "ZBTP Project",
      "participants": [
        "828c0b23e115589cd5708e9bf1578a37c231152225cf5aa35e3ea3bffc721924",
        "989a0a805578bffd03e0bebd0f022355e71b2084717d2c7143d377313c69fbf6"
      ],
      "referenced_project_id": null,
      "external_link": "https://github.com/kisec825/zbtp",
      "created_at": "2025-12-16T06:42:44.786168Z",
      "random_salt": "1b6408c784cfb33b56e77ad624b5b42f",
      "project_id": "ff94e89d9fb7b6e8f293cbb2eb50a9dc5b5a088abc75b6ba352e7d0ea809ca1c"
    }
  ],
  "contributions": [
    {
      "type": "contribution",
      "project_id": "ff94e89d9fb7b6e8f293cbb2eb50a9dc5b5a088abc75b6ba352e7d0ea809ca1c",
      "contributor_key": "828c0b23e115589cd5708e9bf1578a37c231152225cf5aa35e3ea3bffc721924",
      "role": "Lead Dev",
      "description_hash": "ff916084a8ae6c8c611d67b0e6af7e4e0cca077bbc3d2858737f2357dbbbe99f",
      "description_text": "Initial Commit",
      "created_at": "2025-12-16T06:42:49.425285Z",
      "signature": "3720f46c6908fb1de26cbcef87e97fc3f9a594fa671d421b1e418d3badbf1b984aa1b58024489fb9502a9c3fd381e92aaff639621c12b998d6326207ffcdee08"
    }
  ],
  "confirmations": [
    {
      "type": "confirmation",
      "project_id": "ff94e89d9fb7b6e8f293cbb2eb50a9dc5b5a088abc75b6ba352e7d0ea809ca1c",
      "contribution_hash": "eddcfcc802385a453ce69e8efdcb157fe3bf7c000b2c3806dca9979229836e87",
      "confirmer_key": "989a0a805578bffd03e0bebd0f022355e71b2084717d2c7143d377313c69fbf6",
      "created_at": "2025-12-16T06:42:54.790473Z",
      "signature": "8aa8c168185370c4afe65c7f930de8a44d87e3067c34d3e650e9f1fcb183ec9fd898721d697ef89c3ebaded158e7b5c62cc13f3bb2ab25577c4506513d45de07"
    }
  ]
}